{"schema":"corvus.organism.capability_profile.v1","contract_sha256":"a0096f1c49f3012b89c256c30eb6c9e2892a8f7a3ff8b68b2da80538c91fa011","scope_id":"systems/memory-and-evidence/subsystems/hall-projection","profile_id":"subsystem-controller.v1","role_id":"subsystem-controller.v1","capabilities":["scoped_read","handoff"],"forbidden_effects":["hall_write","sqlite_write","cross_system_write","lifecycle_acceptance","parent_authority","automatic_launch","provider"],"authority_grant":false,"automatic_launch":false,"descendants":0,"model_policy_ref":"corvus.model-policy.v1#observer","controller_generation_rule":"cstar-durable-state","closed":true,"profile_sha256":"a0096f1c49f3012b89c256c30eb6c9e2892a8f7a3ff8b68b2da80538c91fa011"}
