{"schema":"corvus.organism.capability_profile.v1","contract_sha256":"a0096f1c49f3012b89c256c30eb6c9e2892a8f7a3ff8b68b2da80538c91fa011","scope_id":"systems/immune-and-validation/subsystems/corvus-eye","profile_id":"validator.v1","role_id":"validator.v1","capabilities":["independent_candidate_read","tests","result_packet"],"forbidden_effects":["candidate_implementation","implementation_ancestry","lifecycle_mutation","provider","protected_effects","automatic_launch"],"authority_grant":false,"automatic_launch":false,"descendants":0,"model_policy_ref":"corvus.model-policy.v1#validator","controller_generation_rule":"cstar-durable-state","closed":true,"profile_sha256":"a0096f1c49f3012b89c256c30eb6c9e2892a8f7a3ff8b68b2da80538c91fa011"}
