{
  "schema":"corvus.organism.capability_profile.v1","contract_sha256":"a0096f1c49f3012b89c256c30eb6c9e2892a8f7a3ff8b68b2da80538c91fa011","scope_id":"systems/nervous-system","profile_id":"system-controller.v1","role_id":"system-controller.v1","capabilities":["list","read","send","wait","handoff","declared_system_dispatch"],"forbidden_effects":["parent_authority","unbounded_descendants","protected_effects","direct_reducer_write","automatic_launch"],"authority_grant":false,"automatic_launch":false,"descendants":0,"model_policy_ref":"corvus.model-policy.v1#supervisory-orchestrator","controller_generation_rule":"cstar-durable-state","closed":true,"profile_sha256":"a0096f1c49f3012b89c256c30eb6c9e2892a8f7a3ff8b68b2da80538c91fa011"
}
